[
  {
    "id": "F1-fx1",
    "skill": "F1",
    "type": "single",
    "stem": "A chocolate bar is cut into 8 equal pieces and you eat 3. What fraction of the bar did you eat?",
    "options": [
      { "text": "$\\frac{3}{8}$", "correct": true },
      { "text": "$\\frac{8}{3}$", "correct": false, "misconception": "whole_number_bias" },
      { "text": "$\\frac{3}{5}$", "correct": false, "misconception": "whole_number_bias" },
      { "text": "$\\frac{5}{8}$", "correct": false, "misconception": "computation" }
    ],
    "representation": "bar",
    "band": "both",
    "source": "generated",
    "reviewed_by": "fixture",
    "reviewed_at": "2026-09-04"
  },
  {
    "id": "F1-fx2",
    "skill": "F1",
    "type": "single",
    "stem": "Which is the bigger share of one pizza: $\\frac{1}{3}$ or $\\frac{1}{8}$?",
    "options": [
      { "text": "$\\frac{1}{3}$", "correct": true },
      { "text": "$\\frac{1}{8}$", "correct": false, "misconception": "denominator_magnitude" },
      { "text": "They are the same", "correct": false, "misconception": "whole_number_bias" }
    ],
    "representation": "word",
    "band": "both",
    "source": "generated",
    "reviewed_by": "fixture",
    "reviewed_at": "2026-09-04"
  },
  {
    "id": "F3-fx1",
    "skill": "F3",
    "type": "single",
    "stem": "Which fraction is equivalent to $\\frac{2}{3}$?",
    "options": [
      { "text": "$\\frac{4}{6}$", "correct": true },
      { "text": "$\\frac{4}{5}$", "correct": false, "misconception": "whole_number_bias" },
      { "text": "$\\frac{2}{6}$", "correct": false, "misconception": "equivalence_as_change" },
      { "text": "$\\frac{3}{2}$", "correct": false, "misconception": "computation" }
    ],
    "representation": "symbolic",
    "band": "both",
    "source": "generated",
    "reviewed_by": "fixture",
    "reviewed_at": "2026-09-04"
  },
  {
    "id": "F7-fx1",
    "skill": "F7",
    "type": "numeric",
    "stem": "What is $\\frac{1}{4} + \\frac{2}{4}$? Answer as a decimal.",
    "answer": { "value": 0.75, "tolerance": 0.01 },
    "representation": "symbolic",
    "band": "both",
    "source": "generated",
    "reviewed_by": "fixture",
    "reviewed_at": "2026-09-04"
  },
  {
    "id": "F4-fx1",
    "skill": "F4",
    "type": "multiple",
    "stem": "Which of these fractions are greater than $\\frac{1}{2}$? Pick all that apply.",
    "options": [
      { "text": "$\\frac{3}{4}$", "correct": true },
      { "text": "$\\frac{5}{8}$", "correct": true },
      { "text": "$\\frac{2}{5}$", "correct": false, "misconception": "whole_number_bias" },
      { "text": "$\\frac{1}{3}$", "correct": false, "misconception": "denominator_magnitude" }
    ],
    "representation": "symbolic",
    "band": "13-17",
    "source": "generated",
    "reviewed_by": "fixture",
    "reviewed_at": "2026-09-04"
  },
  {
    "id": "F9-fx1",
    "skill": "F9",
    "type": "short",
    "stem": "Write $\\frac{1}{2} \\times \\frac{3}{4}$ as a fraction in lowest terms.",
    "answer": { "value": "3/8", "accept": ["3/8", "three eighths", "0.375"] },
    "representation": "symbolic",
    "band": "both",
    "source": "generated",
    "reviewed_by": "fixture",
    "reviewed_at": "2026-09-04"
  }
]
